{
  "schemaVersion": "1.0.0",
  "datasetId": "vuhocpublic-data",
  "datasetVersion": "2026-08-03-contract-probation",
  "sourceCommit": "dec17acbe2b409e0aa5daeb4db820d3e95d05bdf",
  "groundTruthStatus": "DRAFT",
  "promotionAllowed": false,
  "mappings": [
    {
      "category": "cv",
      "documentType": "CV",
      "businessFamily": "CV",
      "route": "GENERIC_IDP",
      "templateFirst": "UNSUPPORTED",
      "schemaRef": "schemas/hr_document_families/cv.schema.json",
      "formatPolicy": {
        "PLAIN_TEXT": "NATIVE",
        "DOCX": "NATIVE",
        "IMAGE": "OCR_REVIEW",
        "PPTX": "NATIVE_PARTIAL",
        "PDF_SCAN": "OCR_REVIEW"
      },
      "mappingNote": "Active Ground Truth review uses 10 HR-recruiting fields for DOCX/IMAGE/PDF_SCAN; PLAIN_TEXT and PPTX remain inventory-only."
    },
    {
      "category": "contract",
      "documentType": "EMPLOYMENT_CONTRACT",
      "businessFamily": "CONTRACT",
      "route": "GENERIC_IDP",
      "templateFirst": "UNSUPPORTED",
      "schemaRef": "schemas/hr_document_families/probation_contract.schema.json",
      "formatPolicy": {
        "PLAIN_TEXT": "NATIVE",
        "DOCX": "NATIVE",
        "IMAGE": "OCR_REVIEW",
        "PPTX": "NATIVE_PARTIAL",
        "PDF_SCAN": "OCR_REVIEW"
      },
      "mappingNote": "External contract cases are probation agreements; review uses the reduced 14-field probation schema."
    },
    {
      "category": "ielts",
      "documentType": "CERTIFICATE",
      "businessFamily": "CERTIFICATE",
      "route": "GENERIC_IDP",
      "templateFirst": "UNSUPPORTED",
      "schemaRef": "schemas/hr_document_families/certificate.schema.json",
      "formatPolicy": {
        "IMAGE": "OCR_REVIEW",
        "DOCX": "NATIVE_EMBEDDED_IMAGE_REVIEW",
        "PDF_SCAN": "OCR_REVIEW"
      },
      "mappingNote": "Certificate review keeps recipient, credential and issue metadata; recipient_name is the printed family name + first name string; overall_score is the only score field. Independent Ground Truth review is required before promotion."
    }
  ]
}
